{
  "$schema": "../../feedback-item.schema.json",
  "schema_version": "1.0.0",
  "id": "kimi-k3-2026-08-11-003-range-unavailability-semantics",
  "title": "Standardize unavailable symbol-range representation",
  "area": "Grammar and absence semantics",
  "state": {
    "lifecycle": "adjudicated",
    "decision": "accepted",
    "implementation": "complete",
    "decided_on": "2026-08-12",
    "decided_by": "James and Codex",
    "decision_rationale": "Accepted and completed in MKTCTX/4: unavailable symbol locations use range_status=unavailable instead of overloading a source range."
  },
  "provenance": {
    "source_type": "external-model-feedback",
    "source_name": "Kimi",
    "source_model_version": "K3",
    "relayed_by": "James via Codex chat",
    "received_on": "2026-08-11",
    "source_label": "Kimi K3 critique: sentinel values versus explicit absence",
    "review_target": "MKTCTX/3 Continuum packet; exact artifact not identified"
  },
  "feedback": {
    "verbatim": "range=unknown is a string sentinel in a field that otherwise has a grammar. Either omit the key or use status=unavailable reason=... like @edges does.",
    "normalized_claim": "Unavailable symbol ranges should use one explicit, typed absence convention instead of overloading the range field with an unknown sentinel."
  },
  "repository_context": {
    "observed_version": "mktxt 3.0.0 / MKTCTX/3 worktree",
    "current_behavior": [
      "Symbol records always emit a range field.",
      "Known ranges use range=Lx-Ly; missing start or end positions use range=unknown.",
      "Other packet sections, including edges and outlines, use status and reason fields to represent unavailable analysis."
    ],
    "evidence": [
      "src/context.ts: renderSymbolRecord",
      "src/context.ts: renderContextV3 edge and outline blocks"
    ]
  },
  "proposal": {
    "summary": "Choose and normatively apply a typed convention for unavailable symbol locations, with reason provenance where the analyzer can supply it.",
    "candidate_changes": [
      "Replace range=unknown with range_status=unavailable and an optional reason, or omit range while requiring an explicit location status.",
      "Define whether partially known start-only or end-only locations are representable.",
      "Carry analyzer-provided reasons through symbol construction when ranges cannot be resolved.",
      "Add grammar and compatibility tests for known, unavailable, and partially known positions."
    ],
    "non_goals": [
      "Do not invent source locations that the analyzer did not establish.",
      "Do not remove symbols solely because their ranges are unavailable.",
      "Do not conflate outline availability for a file with range availability for each symbol."
    ]
  },
  "evaluation": {
    "questions": [
      "Is an omitted range distinguishable enough from a generator bug?",
      "Which unavailable reasons can be stable across analyzers?",
      "Should the convention generalize to every optional structured field?"
    ],
    "risks": [
      "Additional status fields can increase tokens for a relatively rare case.",
      "Reason vocabularies can become analyzer-specific and unstable.",
      "Changing the symbol-record grammar requires a format-version bump."
    ],
    "evidence_needed": [
      "Counts and examples of range=unknown across representative packets.",
      "Analyzer diagnostics showing why ranges are absent.",
      "Parser-complexity comparison for sentinel, omission, and explicit-status designs."
    ],
    "decision_dependencies": [
      "chatgpt-2026-08-11-004-formal-grammar-and-collision-rules"
    ]
  },
  "related_items": [
    "chatgpt-2026-08-11-004-formal-grammar-and-collision-rules"
  ]
}
