{
  "$schema": "../../feedback-item.schema.json",
  "schema_version": "1.0.0",
  "id": "kimi-k3-2026-08-11-005-deterministic-canonical-serialization",
  "title": "Specify deterministic canonical packet serialization",
  "area": "Reproducibility and content addressing",
  "state": {
    "lifecycle": "adjudicated",
    "decision": "accepted",
    "implementation": "complete",
    "decided_on": "2026-08-12",
    "decided_by": "James and Codex",
    "decision_rationale": "Accepted as mktctx-cjson-1 sorted-key canonical JSON and deterministic wire/test-vector rules."
  },
  "provenance": {
    "source_type": "external-model-feedback",
    "source_name": "Kimi",
    "source_model_version": "K3",
    "relayed_by": "James via Codex chat",
    "received_on": "2026-08-11",
    "source_label": "Kimi K3 critique: determinism is unclaimed",
    "review_target": "MKTCTX/3 Continuum packet; exact artifact not identified"
  },
  "feedback": {
    "verbatim": "If two runs over identical input produce byte-identical output, the packet itself becomes content-addressable. Say so explicitly and specify canonical serialization: selection order, key order, and line endings.",
    "normalized_claim": "MKTCTX should make a normative determinism commitment, backed by canonical ordering, escaping, line-ending, analyzer, and generator-version rules."
  },
  "repository_context": {
    "observed_version": "mktxt 3.0.0 / MKTCTX/3 worktree",
    "current_behavior": [
      "The renderer emits fields and blocks in fixed code order and contains no timestamp or random nonce.",
      "Manifest identity uses JSON.stringify over a constructed object whose property and array ordering follow generator behavior.",
      "Selection order is declared, stable path-derived file IDs are deterministic, and terminators are digest-derived with deterministic collision expansion.",
      "The repository does not yet publish a canonical-serialization contract or cross-platform reproducibility test proving byte-identical output for identical declared inputs."
    ],
    "evidence": [
      "src/context.ts: renderContextV3",
      "src/context.ts: createContextManifest",
      "src/context.ts: stableFileId and chooseContentTerm",
      "src/context.test.ts"
    ]
  },
  "proposal": {
    "summary": "Define a canonical serialization and input model under which conforming generators produce the same packet identity, and preferably identical packet bytes, for identical inputs.",
    "candidate_changes": [
      "Specify block order, attribute order, quoting and escaping, path normalization, file ordering, symbol ordering, newline policy, and terminal newline behavior.",
      "State which generator and analyzer outputs are identity inputs and how unavailable or nondeterministic analyzer data is handled.",
      "Publish canonical manifest serialization and packet-byte test vectors.",
      "Add repeated-run and cross-platform tests that compare both manifest hashes and exact packet bytes."
    ],
    "non_goals": [
      "Do not claim reproducibility across different source bytes, analyzer versions, selection policies, or format versions.",
      "Do not introduce timestamps or random IDs into the canonical packet core.",
      "Do not assume JavaScript object insertion order is a sufficient normative specification."
    ]
  },
  "evaluation": {
    "questions": [
      "Is canonical identity semantic, byte-level, or a two-layer contract?",
      "Which platform-specific path and newline behaviors must be normalized before serialization?",
      "Can graft produce deterministic symbol ordering and signatures across supported environments?"
    ],
    "risks": [
      "A byte-identical guarantee can constrain harmless future formatting changes.",
      "Analyzer nondeterminism can break packet determinism even when source files are unchanged.",
      "Canonical path normalization can misrepresent repositories with platform-sensitive filenames."
    ],
    "evidence_needed": [
      "Repeated-run results over diverse fixtures and large repositories.",
      "macOS, Linux, and Windows generation comparisons.",
      "A canonical serialization specification with independent implementation test vectors."
    ],
    "decision_dependencies": [
      "chatgpt-2026-08-11-005-whole-packet-integrity",
      "grok-2026-08-11-003-selection-reproducibility",
      "kimi-k3-2026-08-11-002-encoding-and-normalization"
    ]
  },
  "related_items": [
    "chatgpt-2026-08-11-005-whole-packet-integrity",
    "grok-2026-08-11-003-selection-reproducibility"
  ]
}
